title,point,date,review
클레멘타인,10,19.04.22,영화의 시작과 끝...
아사코,10,19.04.22,솔직히 카라타에리카를 봐서 평점은 10점 준다만.. 영화는 지극히 평범하면서도 개연성은 많이 떨어진다고 느낌..
돈,8,19.04.22,진짜 기대 않고 봤는데 초반처음에 왠 재미없게 주식? 이랬는데 점점 몰입도도 높아지고 전개가 스피디해짐. 주식으로도 영화가  재밌을 수도 있구나 하고 느낌.
덤보,10,19.04.22,오랜만에 보는 영화다운 영화
캡틴 마블,6,19.04.22,앤드게임을 위한 지나치는 과정
항거:유관순 이야기,10,19.04.22,연기 덕분인지 몰입도가
유랑지구,10,19.04.22,잼있어요  cg도 대박인
크게 될 놈,10,19.04.22,손호준 연기 진짜 잘하네요. 김해숙씨는 말할것도 없구요~ 엄마의 사랑이 대단하게 느껴지는 영화네요. 한번은 볼만합니다. 손호준 화이팅이요!!!!
미녀와 야수,2,19.04.22,내가 늙은건가. 별 감흥이 없다. 꼭 노래를 불러야 하나. 주인공들의 심리의 흐름을 더 자세히 묘사하고 그냥 더 진지하게 만들었으면 좋았을텐데
생일,8,19.04.22,잊을 수 없고 감출 수 없는 상처를 어떤식으로 안고 살아가야 하는지 인간적으로 다가가는 따뜻한 영화. 영화 자체의 평가만 한다면 자극적인 시퀀스 없이 감정으로 이야기를 이끄는 시나리오가 일품인 작품이다.
특수부대 전랑2,1,19.04.22,미국은 실제로 세계최강이기라도 하지.. 그리고 미국은 최소한 지네랑 아무 상관없는 국가의 일과 연관지어서 영웅행세하고 국뽕을 만들어내진 않는다.
창,10,19.04.22,전에는 그냥 야한영화라고만 생각했었다...내 나이 30대 후반. 설명이 필요없다..가슴이 아프다..눈물이 흐른다.. 모든 배우들 연기 너무  잘한다..
왓칭,10,19.04.22,실제로 일어날 수도 있지 않으까 하는 생각이ㅠㅠ
노팅 힐,10,19.04.22,노팅힐노팅힐 하는지 이제 알앗네요. 시간이 지나 보아도 여전한 감동이 있어요. Ost도 너무 좋구요.
"다시, 봄",10,19.04.22,따뜻한 영화꼭 보세요감성이 있는 분이라면
미성년,1,19.04.22,마지막 도랏???ㅋㅋㅋㅋ
생일,9,19.04.22,눈물을 짜내지 않고 슬픈영화. 정말 신경써서 잘 연출했다.
어벤져스: 인피니티 워,9,19.04.22,코스믹 호러까지 해내는 마블
"다시, 봄",9,19.04.22,잔잔하고 아름다운 영상미가  좋았고 색다른 주제가 좋았어요. 하지만 웃음코드가 전무한 것이 아쉬웠어요.
요로나의 저주,10,19.04.22,강적이다ㄷㄷㄷ 이렇게 무서운 공포영화는 오랜만이다
범블비,8,19.04.22,괜츈~!~!~!~!~!}!~!!~!~!~!~!~!~~여주 존멋
돈,9,19.04.22,재밌었어요 ㅎㅎ 김재영 너무 잘생겼네요 ㅎ
돈,6,19.04.22,영화 작전이 훨낫네..이런 영화는 끝도 잘살려야 하는데..
어벤져스: 에이지 오브 울트론,7,19.04.22,기대만큼은 해주지만 많은 등장인물을 효과적으로 조합한 1편에 비해 장점이 줄고 단점이 늘어난 속편
요로나의 저주,8,19.04.22,뒤에서 팝콘 던진사람때문에 더놀람 ㅋㅋㅋ
요로나의 저주,10,19.04.22,공포영화는 이렇게 만들어야지 ㅋㅋ
생일,10,19.04.22,자식을 잃은 부모의 마음은 누구도 달래줄수 없는것 같아요. 참 조심스러운 메시지를 알뜰히 전해주신것 같네요. 설경구씨와 전도연씨의 농도깊은 연기력에 감정이입 되었습니다.
생일,2,19.04.22,해마다 나오는 518 세월호 반일 노무현영화
캡틴 마블,10,19.04.22,난 또 페미라고 해서 뭔가 했더니...전혀 아님난 정말 재밌게 봤다 괜한 물타기로 영화 질을 님들이 낮추지 말자...
크게 될 놈,10,19.04.22,역시 실화라서 더 슬프고 감동인 영화
아마겟돈,6,19.04.22,<유랑지구>보니 생각난다.  마이클 베이의 정신 사나운 연출.
라스트 미션,7,19.04.22,가정에 충실하지 못한 영감 우연한 기회로 인해 마약운반책을 한다 큰 돈을 벌고 계속 하다가 나중에 잡힌다~ 별 내용은 없고 호불호가 갈릴영화 누군가에겐 감동과 인생을 되돌아볼수 있는 영화일테고 누군가에겐 그저그런 영화일수도 있는 그런 영화~
사하라,8,19.04.22,고1 때  보고 지금껏  잊혀지지  않는 영화네요. 하이틴로맨스 같은 영화. 다시 보고픈데  자료를 찾을 수가  없네오ㅡ . 아시는 분 알려주세요 .
가디언즈 오브 갤럭시 VOL. 2,7,19.04.22,욕심을 부렸는지 좀 과해졌지만 가오갤만의 흥과 색깔은 그대로.
언니,10,19.04.22,이시영 완전 화끈하게 두들겨패줘서 통쾌했어요
크게 될 놈,10,19.04.22,눈물쏙 뺐네요. 배우분들 고생했습니다. 연기 굿!! 강추
악질경찰,2,19.04.22,세월호?십자십자열자열자
캡틴 마블,10,19.04.22,주인공 보면서 제 안에 나약함을 강함으로 바꿀 수 있다는 생각이 들었어요. 페미관점 보다는 누구나 갖고 있는 나 만의 울타리 한계점을 생각하게 하네요.
우상,6,19.04.22,초반에는 꽤 괜찮더니...
요로나의 저주,10,19.04.22,"시간가는줄 모르고 푹빠져서 봤습니다, 목에 담걸리는줄"
왓칭,10,19.04.22,보는내내 긴장감 최고.. 연기최고..
글래스,9,19.04.22,미쳤네 진짜; 영화 2개가 하나의 자식을 낳아 버렸다
악질경찰,3,19.04.22,이영화 정말  대단합니다..중구난방. 세월호가 여기서 왜나오는지  이런 어거지 설정에   ..영화 아저씨도 돌이켜 보면 대사 정말 유치찬란 많았는데  이건 뭐  보다가 암걸리는줄
생일,10,19.04.22,자꾸 천안함하고 비교하는 정치적인 인간들애들이 우리나라수호하려고 배를탔니천안함 순직 군인들 또한 욕보이는짓하지마라군인이라고하면 목숨걸고 나라지키는게 당연한 의무이자 명예 인데나라를 지키고자순직하신분들을 사고사 랑 동일선상에 물타기하는게말이되니
늑대소년,10,19.04.22,안봤는데 박보영너와서 ㅋㅋ
콜레트,8,19.04.22,만나서 영광이었어요 콜레트! 콜레트 2 나와야 할 판
미성년,10,19.04.22,"너무너무 재밌고 이런 한국 영화 또 없습니다!!!! 앤드게임이 나오기 전 꼭 봐야하는 영화 , 전래 없는 한국 영화, 미성년 꼭 보세요!! 안보면 개후회!"
미스터 고,1,19.04.22,안보는게 여러모로 이득인 부분
왓칭,10,19.04.22,사회적인 메세지도 있고 재밌게 보고 온 왓칭
요로나의 저주,10,19.04.22,93분동안 긴장의 연속이었습니다
요로나의 저주,8,19.04.22,애나벨네 아논 신부님ㄷㄷ
신과함께-인과 연,1,19.04.22,ㅈㄷㅁ러ㅓㅣㅏㄴ어러디ㅏㅓ리
왓칭,10,19.04.22,으.밤에 보고나와서.. 지하주차장가는데 너무무서웠어요ㅡ.ㅜ엔딩크레딧에보니까 원작 p2이렇게나와있던데 한번찾아보고싶어요 ㅎㅎ이학주배우분께서 되게연기잘하시던데요..
요로나의 저주,8,19.04.22,안무섭다고 한 사람 나와요!!!  개무섭잖아
요로나의 저주,10,19.04.22,진짜 핵무서움 ㅠㅠㅠㅠ 컨저링 보다 더무서워요
왓칭,10,19.04.22,반전에 반전 재미난 영화ㅎㅎ
생일,1,19.04.22,아직도 육수가 나오는 무한의사골
썬키스 패밀리,5,19.04.22,인생이 그렇게 쉬운 일은 아닌데 너무 쉽게  오해가 풀린다. 오해할 수 밖에 없는 상황을 인위적으로 만들고 인위적인 반전 스토리가 어설프다.
왓칭,9,19.04.22,스릴감있고 재미있게 봤어요~~
요로나의 저주,10,19.04.22,OO 혼자 보지말걸 그래따
노무현과 바보들,2,19.04.22,너무 신격화 된 영화. 아예 종교를 만들어라.
왓칭,10,19.04.22,별로 기대를 안하고 봐서 그런가 너무 재밌었다
자전차왕 엄복동,1,19.04.22,어벤져스: 엔드게임 10UBD 달성.
미성년,10,19.04.22,감독이 김윤석이라서 놀랐다. 김윤석이 영화를 이렇게 잘 만든다고?
캡틴 마블,10,19.04.22,시대상에 적합한  여성 히어로물이라고 생각합니다 사이다같은  말투와 액션씬  정말 너무 멋있었구요 당당한  자신감과 행동으로 관객들의 마음을  사로잡는 것 같습니다 추천드립니다
헬보이,5,19.04.22,리부트 전편보다 약간 부족한 감이 있음
자전차왕 엄복동,10,19.04.22,이거 신생배급사한테 텃새부리는 대기업 배급사의 횡포 같은데? 영화 괜찮은데 왜 평점테러?  물론 아직 보진 못했다.
왓칭,10,19.04.22,스릴러 영화로 만족합니다 잘 봤습니다
생일,10,19.04.22,혼자 영화보기 좋은 영화입니다 간만에 영화다운 영화를 봤습니다 오열하고 왔습니다
왓칭,10,19.04.22,오랜만에 보는 스릴러 영화는 긴장감 넘쳤다!
요로나의 저주,10,19.04.22,스토리도 탄탄하고 소름끼치네요
모아나,10,19.04.22,가슴이 벅찹니다. 정체성에 대해 생각해보게 하는 어른 동화
미성년,10,19.04.22,감독님들.. 반성 하세요. 한국영화 이만큼 할 수 있었네요.
신세계,10,19.04.22,내용굿 영상굿  배우굿  다좋네요. 사간 가는줄 모르고 잠안자고 봄.
요로나의 저주,10,19.04.22,무서운데도 끝까지 보게함;;
왓칭,10,19.04.22,긴장감있고 쫄깃하게 잘 봤습니다~~
왓칭,8,19.04.22,이제 지하주차장 무서우꺼 같아ㅠㅠㅠ
생일,8,19.04.22,소중한 사람의 빈자리가 너무 큰것같아 눈물이 많이 났네요아들을 남편이자 아들이자 친구로 여기고 지낸 엄마심정이 이해가 됩니다고인들의 명복을 한번더 빕니다
노무현과 바보들,10,19.04.22,최고였고 마음이 너무 아팟습니다.
막다른 골목의 추억,10,19.04.22,여운이 남는 영화네요일본 가보고 싶어요
뷰티플 마인드,10,19.04.22,영화  보는 내내 울기도 웃기도 하며 저에게 잔잔한 감동을 주었습니다. 아이들을 믿고 격려와 지지를 해주시는 선생님들과 부모님들속에  아이들이 잘 성장해 가는 모습이 아름답고 예뻤어요.더욱 많은 분들이 보고 가동을 느꼈으면 합니다
클레멘타인,10,19.04.22,어벤져스 엔드게임 다행인줄알아라 지금 이 영화가 나온다면 국물도 없어
요로나의 저주,8,19.04.22,음향효과가 확실히 쩔었음중후반엔 스토리 전개나 풀어나가는 과정이 부실했지만 초반의 분위기만으로도 압도
캡틴 마블,7,19.04.22,너무쎄서 ~감당못할자 없을듯
생일,10,19.04.22,정말 조심스럽게 다룬 내용에 눈물흘리고갑니다
알리타: 배틀 엔젤,8,19.04.22,총몽이라는 만화를 보고싶어짐!
왓칭,10,19.04.22,적당히 볼만 했어요 스릴넘칩니다
베스트 오브 미,10,19.04.22,도슨 캐스팅이 조금 에러지만영화 너무 좋네요ㅡ
겟 아웃,10,19.04.22,마지막 경찰차에서 내리는 그순간 그전 크리스가 무조건적인 손들때 삶이 어떻게살아왔나를  몇초컷에 다보여주는 느낌..
왓칭,10,19.04.22,무서운것 보단 스릴 넘치고 긴장 엄청됨
캡틴 마블,10,19.04.22,우리의 능력을 의심하게 하고 한계짓는 유리천장을 여주인공의 상징성을 통해 통쾌하게 부셔버려서 대리만족을 느꼈어요.누구에게도 나의 능력을 증명받을 필요없고 인정받을 필요없다. 나는 나로서 완전하고 놀랍다!
노무현과 바보들,10,19.04.22,"어떤 방식으로 전달하든, 메시지는 녹슬지 않는다."
아틱,8,19.04.22,추락한 헬기에서 생존자를 봤을 때.... 난 내가 썩었다는걸 느꼈다.
악질경찰,10,19.04.22,p2p에 올라오면 좋을테네요. 돈(머니)은 오늘 자로 다운받을 수 있는 곳에 신규로 올라왔던데. 많은 사람들이 볼 수 있도록 p2p에 얼른 올라왔으면 합니다 네플릭스는 제가 잘 모르니.
요로나의 저주,10,19.04.22,오늘 밤 잠 다 잤다...ㅋㅋㅋ
요로나의 저주,9,19.04.22,소름끼쳐서 혼낫어요 ㅠㅠㅠ;;
아인,7,19.04.22,악역에 더 공감이 되는 영화! 그리고 카와에이 리나를 여기서 우연히 다시 만나서 반가웠다.
왓칭,8,19.04.22,생각보다 몰입도가 상당하더라ㅋㅋㅋ그 남주 싸패 연기는 인정!!
생일,10,19.04.22,앞뒤옆 다 코훌쩍이기 바빴던.... 손수건 챙겨가세요 ㅠ
왓칭,10,19.04.22,도어락이랑 목격자랑 비슷한 느낌의 스릴러 영화~ 생각보다 재밌게 본 듯!
크게 될 놈,6,19.04.22,엄니의 연기력 정말 좋았습니다 오랜만에 펑펑 울었어요
유랑지구,8,19.04.22,스케일 하나는 15억급! 지구에 모터 달고 저 머나먼 우주로오~
우리 학교,10,19.04.22,우리 민족의 정서와 얼을 지켜가고 있는 혹가이도의 동포들에게 마음으로부터 깊은 감사와 찬사를 보냅니다.
왓칭,10,19.04.22,왜이렇게 입소문이 안타져? 진짜 넘 무서움..
어스,10,19.04.22,정말 재미있어요 또 보고싶어요
크게 될 놈,10,19.04.22,손호준 김해숙의 완벽한 내면 연기 감동 그자체~
왓칭,8,19.04.22,강예원 연기 진짜 소름ㄷㄷ
요로나의 저주,10,19.04.22,굿굿 오랜만에 오싹오싹
요로나의 저주,10,19.04.22,스엑으로 보니까 개쩔어요 ㅋㅋ
요로나의 저주,10,19.04.22,눈감고 머리도 못감게하다니ㅠㅠㅠ
크게 될 놈,10,19.04.22,"제가 좋아하는배우 김해숙님 나오셔서 12살 아들램,언니 랑 보러 갔는데..호준님..연기 대박!언니는 영화 지루하다카고 아들은 별로라 카고 전 재밌게 봤네요..연령층이 대부분 50~60대 분들이 많이 보시드라고요..그 손목이 뭣이라꼬ㅠ 흥했음 좋것어요!"
요로나의 저주,9,19.04.22,극장에서 봐야하는 영화
크게 될 놈,10,19.04.22,어머니의 안타까운 마음과 사랑에 얼마나 울었는지 모릅니다.
왓칭,9,19.04.22,소름입니다 시간가는줄 모르고 봤습니다
왓칭,10,19.04.22,사이코패스 연기 ㅋㅋㅋ 진짜 사이코인줄 알았네
왓칭,10,19.04.22,무대를 뒤집어 놓으셨다
헬프,10,19.04.22,암울한 시대를 유쾌하게 보여준  기분 좋아지는 영화.
노무현과 바보들,5,19.04.22,웃긴게 있을때는 욕 ㅈㄴ 하다가 죽으면 보고싶습니다 삼가고인  명복 비느니 어쩌니 ㅉㅉ 있을때 믿고 잘해라
유랑지구,10,19.04.22,중국영화도 많이 발전했네요!! 깜짝 놀랄만한 띵작이니요 ㅋㅋ
레이크 하우스,7,19.04.22,부드럽고 매끄러운 리메이크. 헐리웃 로맨스로서 보여줄 수 있는 건 다 보여줘.
크게 될 놈,10,19.04.22,뻔한 내용인거같은데.. 왜케 감동적인지..보는 내내 마음이 뭉클 감동적인 영화였어요..
캡틴 마블,10,19.04.22,"멋있었음 최고의 히어로 같음 꿈에 나올법한 ..,"
바이스,8,19.04.22,빅쇼트가 더 재밌었음. 그러나 용기하나는 정말 대단한것같다
노무현과 바보들,10,19.04.22,그립습니다 노대통령님존경합니다
"나를 책임져, 알피",10,19.04.22,시에나 밀러 ㄲㅈ  +5점해서 10점
돈,10,19.04.22,배우들의 열연에 더 재미지네요 류준열 연기가 많이 성장한게 보여요
사바하,10,19.04.22,재밌어요.이런 영화가 많이 나왔으면 합니다.
유랑지구,10,19.04.22,엄복동 vs 유랑지구 당신의 선택은?
왓칭,9,19.04.22,스릴러 보고 싶어서 봤는데 잘 봤습니다~
유전,5,19.04.22,오컬트는 나랑 안맞나봐   우선 너무 잔인해서 못보것음...
미성년,9,19.04.22,김윤석..당신은 ..도대체..
글래스,10,19.04.22,맥어보이   연기력   미쳤다.병원직원 그때 얼마나 연기력에  지린건지  인격에  지린건지 ㅋㅋㅋ
왓칭,10,19.04.22,강예원은 진짜 연기 이런거 엄청 잘하네여
왓칭,10,19.04.22,보는내내 지루하지 않고 재미있게 봤어요
왓칭,10,19.04.22,광기어린 싸이코의 잔인한 모습.. 인상적이네요 재밌었어요~!
아픈 만큼 사랑한다,10,19.04.22,종교를 떠나 사람의 생이 이렇게 많은 영향력과 생명을 살렸다면 그 분은 성자 아닐까 생각듭니다 멋진 인생 존경합니다 추상미님 목소리도 좋았습니다
요로나의 저주,6,19.04.22,생각했던것보다 2% 부족한 영화였다.포스터 효과라고나 할까 ? ㅋ
마담 프루스트의 비밀정원,10,19.04.22,영상미 색감 내용 영화분위기 다 좋았어요! 왕추천
미성년,10,19.04.22,상처는 오로지 아이들의 몫.
미성년,10,19.04.22,시실리2키로에서 임창정한테 딱이던  시절이 있었는데 ㅋㅋ지금은..ㅎㄷㄷ
캡틴 마블,8,19.04.22,볼만함 쿠키 영상이 살짝 아쉽지만 재밌다 그래도
유랑지구,10,19.04.22,중국이 이정도여?기대 이상이라 놀랐다.
주먹왕 랄프,10,19.04.22,대박 아이디어. 이 아이디어를 또한 이토록 잘 구현해 내다니! 재밌게봤다.
유랑지구,10,19.04.22,왜 짱깨들이 이런 놀라운 영화를 만드니 배가 아픈가? 극한직업하고 비교해도 게임이 안되는 영화 이런 SF를 만들수있는 중국이 부럽다.
미성년,7,19.04.22,깡패들한테 털리는거랑 마지막 우유씬 갑분싸였음.
"다시, 봄",10,19.04.22,지금 계절에 잘 어울리는 아름다운 이야기
요로나의 저주,10,19.04.22,새벽 1시40분 심야로 봤다. 극장에 나 혼자만 있었다. 롤러코스터나 번지점프나 자이로드롭 떨어질 때 처럼 소름이었다. 이거 볼 만하다. 괜찮다!
유랑지구,10,19.04.22,알리타 보다 잼있음..
요로나의 저주,10,19.04.22,무서운데 재밌어 ㅋㅋㅋㅋ 짜잔!!
요로나의 저주,10,19.04.22,제임스완 공포 ㄹㅇ 인정 ㅠㅠ 무서운데 재밌기도 하고 ㅋㅋ 올해 본 공포 중 젤 재밌다
붉은 돼지,10,19.04.22,하울의 움직이는성이나 센과치히로 같은 작품은 나의 어린시절을 떠올리게 한다면 붉은돼지 는 현재 20대 중반의 내모습을 추억하는 나의 40대 모습이 떠오른다
요로나의 저주,10,19.04.22,스토리도 이 정도면 탄탄하고 공포영화치곤 꽤 볼만
크게 될 놈,10,19.04.22,감동입니다~어머니의 사랑 감사합니다~!이시대에 꼭~필요한 영화입니다꼭~보세요
생일,10,19.04.22,가족을 다시 한번 생각하게 하네요
크게 될 놈,10,19.04.22,감동 그 자체..! 가족의 사랑
크게 될 놈,6,19.04.22,반전이 없어 더 슬픈영화
유랑지구,10,19.04.22,우주 재난영화 덕후로써 재미있었음중뽕도 과한거같지도않고
에브리타임 룩 앳 유,7,19.04.22,"한스 바인가르트너, 비포 시리즈의 연출자였군요"
생일,2,19.04.22,감성팔이영화 나중에 킬링타임으로 다운받아보는게
오늘도 평화로운,10,19.04.22,정말 재미있고 유쾌한 영화입니다 응원합니다
"다시, 봄",10,19.04.22,너무 재밌게 보아서 많은 분들이 보셨으면 좋겠습니다
생일,1,19.04.22,저희가 평생 인지하고 살아야할 일이긴 하지만 영화내용적인것에서 솔직히 잘 모르겠더라구요...
요로나의 저주,9,19.04.22,교훈 : 그러니까 바람피지 말자
사바하,6,19.04.22,결말을 생각하고 영화를 만들지 결말수준이 초딩이네 결말만 좀 깊히있고 세련됐으면 충분히 좋은 평점 받을만한 영화였는데 마무리가 너무 급하고 엉성하네
생일,7,19.04.22,걱정하며 본 영화는 그 날 이후의 가족들의 삶을 잘 그려낸 것 같아서 감명깊게 봤다. 전도연이 섬세한 감정선을 아주 잘 이끌고 간다....
덤보,2,19.04.22,정말 실망... 어린이 영화라고 유치하면 안 돼요 ㅠㅠ
노무현과 바보들,1,19.04.22,"비겁한 현실 도피자. 운동권 꼴통들의 최후 바락, 그냥 죽자"
요로나의 저주,10,19.04.22,믿고보는 컨저링 유니버스! 짜잔 아저씨 은근 하드캐리 ㅎ
생일,10,19.04.22,눈물이 멈추질 않았다 두 주연 배우의 연기력은 가히 마지막 시에서 오열
왓칭,1,19.04.22,저는 영화 평에 관대한 편입니다.근데 이건 좀 너무한 영화네요;;보는 내내 스릴러인데 스릴도 없고 답답함만 가지고 있고;이건 연기자의 연기 문제가 아니고 구성 자체가 너무 별로라는 생각이 듭니다. 정말 실망 스러운 영화였어요
요로나의 저주,10,19.04.22,요로나... 넘 무서워... 비오는 날 투명우산 볼 때 마다 생각날듯
생일,10,19.04.22,"너무 마음이 아려왔고 진짜 잔잔하게 흘러가면서 펑펑 운 영화입니다, 잊지말아요"
스노우맨,1,19.04.22,책을 기대했다면 실망할테고 영상은 틀어놓고 음소거를 한 뒤 클래식 음악이나 재즈 음악을 깔아놓는게 더 낫다.
"다시, 봄",10,19.04.22,시간의 중요함을 깨닫게 해준 영화입니다. 너무 따뜻해요~
헬보이,8,19.04.22,걍  다 떠나서 잔인한  맛으로 난 잼나게보ㅏㅆ음 ㅋ
우상,10,19.04.22,난 잼있게 봐서 10점 세 배우의 연기가 너무 좋았음.
유랑지구,1,19.04.22,부탁인데 중국인들은 입좀 벌리지 마라. 짱깨어 듣는순간 영화 퀄리티가 반감됨.
게이트,1,19.04.22,평점 가지고 장난치지 마라 진짜
굿바이 홈런,10,19.04.22,8년이나 늦었네요 .. 늦게나마 보게되서 영광입니다 !!
라스트 콘서트,7,19.04.22,러브스토리의 이탈리아판?
크게 될 놈,10,19.04.22,"가족 힐링영화 화이팅!부모님께 받은,자식에게 줄, 이웃과 함께할 영원한 사랑을 배워 갑니다.인생을 재정비한 귀중한 시간이었습니다."
악질경찰,1,19.04.22,오랜만에 평식이형 좋은 평론했네  너무 도를 넘은 장사속 영화네 오히려 반감사니 역겹네요
헬보이,1,19.04.22,재미가 하나도 없음 잔인하기만 하고 .. 예전 헬보이 생각하고 봣는데 진짜... 최악
진링의 13소녀,10,19.04.22,아 잘만들었다 ... 일본생키들은 이곳 저곳 똥을 안뿌린 곳이 없었구나
헬보이 2: 골든 아미,9,19.04.22,간만에 다시봤는데 토로 형은 최고다. 신비하고 흥미진진한 이야기 캐릭터. 완전 최고!!
생일,2,19.04.22,"정치적인 영화 스토리는 지루함...다만 보는내내 운건 유가족과 어린 희생자들이 안타까워서...이땅에 죽음은 모두 안타깝다. 천안함, 연평해전, 제천화재사건, 안인득사건도 세월호만큼 챙겨주던지 세월호로 정치질을 말던지.."
요로나의 저주,8,19.04.22,"공포영화는 혼자봐야 제맛이죠. 제임스완 시리즈를 다 봤는데, 수녀나오는편이랑 귀신이 비슷해서, 신선한건 없어도. 깜짝깜짝 놀라긴 했어요. 제임스완의 연출력이란,,믿고보는거죵"
라스트 미션,10,19.04.22,최고였습니다.연기도 내용도
생일,2,19.04.22,"몇 개월 후면 총선 전에 1987, 택시운전사처럼 케이블에서 진저리나게 틀어줄텐데.. 돈 내고 보긴 쫌 아까움"
미성년,6,19.04.22,김윤석이 연출했다고 홍보를 많이했는데. 대세 염정아와 믿고 보는 김윤석이 나와도 흥행은 참패네. 영화가 괜찮아도 이런 드라마는 관객들이 외면하는구나.
코코,10,19.04.22,감히 평점을 주고 싶은 영화...
노무현과 바보들,10,19.04.22,사랑합니다. 진심으로 사랑합니다.
타이타닉,10,19.04.22,무슨 말이 필요해. 10점
왓칭,1,19.04.22,헛웃음 유발 영화 고구마 드시고싶으신분들 당장 보러가세요!!!!
미성년,10,19.04.22,오랜만에 영화 재미있게 잘 보았습니다.
유랑지구,6,19.04.22,너무 감동 강요하고... 비주얼은 보기 좋았으나.. 아직 중국의 한계인듯. 그리고 중국도 맨날 나오는애만 나오는듯하다 저 아버지역할 어디서 많이봤던사람인데 ㅋㅋ
공작,4,19.04.22,발상은 신선하고 영화로서는 볼만했지만  정치색이 짙고 현실성은 없음ㅋㅋㅋ북한한테 퍼주는 김대중편을 들지 북한에서 미쳤다고 우익이랑 편먹음?
우상,1,19.04.22,"묻지마 영화의 대표작.한석규 와이프가 왜 로봇연기를 하는지-빵터짐, 아들이 왜 미소를 지는 지, 설경구 와이프도 설정이 이상하고, 연변사투리 등 각종 사투리로 웅얼웅얼 대사전달도 꽝이고. 이도저도 아닌 묻지마 무비.한석규와 김성녀 때문에 참고 봤음."
뽀로로 극장판 공룡섬 대모험,10,19.04.22,아이들과 재미있게 봤어요
더 이퀄라이저,10,19.04.22,화려하다고 멋진 액션이 아니다
바이스,10,19.04.22,딕 체니를 연기한 크리스천 베일의 선택이 존경스럽다!날조된 권력앞에서 개인이 할 수 있는 것은 무엇일까?지루할 수 있는 정치영화를 젊고 감각적인 연출이 뇌리에 박힘
왓칭,10,19.04.22,"시간 금방가네요 재밌게봤어요 ^^ 다만, 스토리에 특별함은 없는듯"
요로나의 저주,8,19.04.22,100퍼 관람후기영화관 전세낸줄.. 조조로 나홀로 봤는데 졸 무섭.. 무서운 장면 없는 갑툭튀영화..기대안하고 봤는데 잼있음!영화보고 밖에나와서 해를보고 안심이 되었다..
컨테이젼,10,19.04.22,6점대여서 이제 본게 화가나네ㅎ
왓칭,2,19.04.22,강예원 이쁜것 뺴고. 잼 없음. 와 진짜 넘하네.  잼 드럽게 없음
