title,point,date,review
어벤져스: 엔드게임,10,19.04.24,"3000만큼,재밌었다"
어벤져스: 엔드게임,10,19.04.24,이런 영화를 볼 수 있게 해주셔서 감사합니다...마지막에 가서는 계속 눈물이 나게 만드네요 역시 마블 이제 못보는 영웅들이 많네요...엔딩크레딧을 보며 먹먹했습니다 두세번 더 보고싶네요
어벤져스: 엔드게임,10,19.04.24,가장 완벽한 결말이엇다.
어벤져스: 엔드게임,10,19.04.24,10년 넘은 마블영화의 완전판!! 장대한 끝은 뒤로하고 새로운 시작을 알린다
어벤져스: 엔드게임,10,19.04.24,양자영역을 이용하여 어벤져스 맴버들이스톤을 모으는 내용입니다.블랙위도우 사망 소중한걸 희생해야얻을수있는 스톤 호크아이가 죽으려했지만 블랙위도우가 대신 죽습니다.
어벤져스: 엔드게임,10,19.04.24,잼있었어요^^ 미리 예매해두길 잘했네요 친구는 보고싶어도 좌석없어서 못보고있음ㅋㅋ
어벤져스: 엔드게임,10,19.04.24,캡틴은 소울 스톤을 어디에 가져다 놓은것인가?
어벤져스: 엔드게임,10,19.04.24,캡틴아메리카가 묠니르를 다루고 나타샤는 죽고 아이언맨도 죽어버리고.... 캡틴 마블은 파워스톤 거머쥔 타노스 주먹에 기절해버리고 ㅠㅠ 충격에 이은 충격적인 영화!!
어벤져스: 엔드게임,10,19.04.24,11년을 마무리하기에 부족함이 없다 모든걸 담은 최고의 영화.. 말이 필요한가? 가서 직접 확인해보시죠
어벤져스: 엔드게임,10,19.04.24,그동안 감사했습니다.
어벤져스: 엔드게임,2,19.04.24,팝콘과 콜라를 사들고 들어가시오
어벤져스: 엔드게임,10,19.04.24,재밌게 봤습니당@@@
어벤져스: 엔드게임,10,19.04.24,스타크가 눈 감을 때 지난 11년 아이언맨과 함께한 시간이 주마등처럼 스쳐갔다 페퍼는 그를 보내줬지만 난 아직 마음에 준비가 안됐는지 눈물이 흘렀다.잘가요. 아이언맨
어벤져스: 엔드게임,10,19.04.24,모든 주인공들 지난 OO동안 고마웠어요 인생영화!!!
어벤져스: 엔드게임,10,19.04.24,캡틴이 무기를 드는순간 엔드게임이였다
어벤져스: 엔드게임,8,19.04.24,잘봤어용!!!!그래도 어벤저스!
어벤져스: 엔드게임,10,19.04.24,수고했습니다 어벤져스
어벤져스: 엔드게임,10,19.04.24,대미를 장식하였다 한번 더 볼것이더
어벤져스: 엔드게임,10,19.04.24,역대 최고 어벤져스 최고의 한타 최고의 마무리.. 3시간이아니라 30분같았다
어벤져스: 엔드게임,9,19.04.24,오늘 봤지만나는 내일 또 볼것이다.
어벤져스: 엔드게임,10,19.04.24,깔끔한 마무리 굿굿~~
어벤져스: 엔드게임,10,19.04.24,캡틴 할베리카~!!!
어벤져스: 엔드게임,10,19.04.24,왜 3시간인지 알 수 있었던 영화입니다말이 필요없내요 그냥 보세요!
어벤져스: 엔드게임,10,19.04.24,필히 화장실 다녀 오시길...
어벤져스: 엔드게임,8,19.04.24,히어로물중 최강인듯 괜찮은 영화
어벤져스: 엔드게임,9,19.04.24,인피니티 워보단 못한 느낌이지만 재미있었습니다
어벤져스: 엔드게임,10,19.04.24,아이언맨에 의한 토니스타크를 위한 마무리
어벤져스: 엔드게임,10,19.04.24,쿠키영상 기다렷는데....
어벤져스: 엔드게임,10,19.04.24,정말 긴 여정의 대서사시였어요
어벤져스: 엔드게임,10,19.04.24,진짜 그냥 최고 입니다~!!
어벤져스: 엔드게임,10,19.04.24,스포는 자제... 많이 울었네요ㅠㅠ
어벤져스: 엔드게임,10,19.04.24,"11년, 22편 이렇게 완벽한 마무리 할수 있을까 누가 죽던 어쩔수 없는 이별...후반부 액션은 정말 너무 멋져서 입이 쩍 벌어진다 영화보면서 가슴이 아파 오는건 참 오랜만이네"
어벤져스: 엔드게임,10,19.04.24,로다주~~ 아이언맨 사랑해요~~
돈,1,19.04.24,영화라고하기엔;;드라마 스페셜 수준
어벤져스: 엔드게임,10,19.04.24,대장정의 막을 보며 가슴이 먹먹해졌다...
어벤져스: 엔드게임,9,19.04.24,"볼만함. 하지만 화려한 전투보다는 영화가 주는 ""부활과 희생""이라는 정신에 의미를 둬야할 듯. 완벽한 끝이지만 동시에 새로운 시작. 마블의 또다른 시작이 기대됨. 쿠키영상이 없는 이유는 이미 영화 전반에 많은 떡밥이 몇 개 있었음. 유튜버들은 알겠지?"
어벤져스: 엔드게임,1,19.04.24,오늘 저녁에 예약해놨는데 보고 스포 개많이해야지 ㅋㅋ ㅋㄷ
어벤져스: 엔드게임,10,19.04.24,"그냥 ,,대박이라는 말밖에.. 한동안 여운이 많이 남을듯ㅜㅜ까먹고 다시 보고싶어여 흑흑"
어벤져스: 엔드게임,10,19.04.24,매우 재밌게 봤습니다.
어벤져스: 엔드게임,10,19.04.24,전 두번찡했어요. 3000만큼사랑합니다.!!♡♡
어벤져스: 엔드게임,6,19.04.24,음...초중반 너무 지루했...이제 어벤져스 끝나니까 아쉽
어벤져스: 엔드게임,10,19.04.24,최고였습니다. 마블 진짜 사랑합니다
어벤져스: 엔드게임,10,19.04.24,마블 시리즈 모두보신분들은 더재미를 느낄것같아여
어벤져스: 엔드게임,10,19.04.24,소오오오오름.시리즈들 첨부터 다시 보고싶어진다
어벤져스: 엔드게임,8,19.04.24,"""내가 다 살릴수는 없어""_토니그의 말대로 되다."
어벤져스: 엔드게임,10,19.04.24,마블과 함께한 나의 청춘...소중한 마무리를 지어줘서 고마워요!!
어벤져스: 엔드게임,10,19.04.24,제미있고 감동적이았어요 다시한번더보고싶은영화
어벤져스: 엔드게임,10,19.04.24,어벤져스가 이렇게 끝나서 아쉽지만 또 다른 시작이라고 보고 앞으로도 마블 영화 사랑해용~~@@
어벤져스: 엔드게임,10,19.04.24,그냥 진쩌 말그대로 지려버렸다.
어벤져스: 엔드게임,10,19.04.24,보고나오니 마음이 평화로워짐 끝이구나
어벤져스: 엔드게임,10,19.04.24,보고나오니 마음이 평화로워짐 끝이구나
어벤져스: 엔드게임,10,19.04.24,버너ㅜ타쟈둥ㄹ챠기그칭제너츧ㄷ
어벤져스: 엔드게임,9,19.04.24,벅차서 눈물이 났다. 행복했습니다
어벤져스: 엔드게임,10,19.04.24,핵꿀잼 두번보세여 3000번 사랑해여
어벤져스: 엔드게임,10,19.04.24,3000만큼 사랑해!!!! ㅠㅠㅠ
어벤져스: 엔드게임,10,19.04.24,정말로 깔끔한 엔드 게임
어벤져스: 엔드게임,10,19.04.24,이보다 훌륭한 피날레는 없다.
어벤져스: 엔드게임,10,19.04.24,나는.. 나는.. 아이언맨이다..
어벤져스: 엔드게임,10,19.04.24,울었어요 행복했습니다
어벤져스: 엔드게임,10,19.04.24,10년의 퍼즐이 맞춰짐 ㅠㅠ
어벤져스: 엔드게임,10,19.04.24,런닝타임 3시간이라 엄청기네 하고봤는데보다보니 시간 훅가버리네요 굿
어벤져스: 엔드게임,10,19.04.24,감동의 쓰나미~~~~ 그동안 함께했던 친구들~~
어벤져스: 엔드게임,10,19.04.24,3000만큼 재밌고 화장실 갈 틈도 없었고 정말 가고싶다면 그냥 바지에 지릴정도로 재밌었음 ㅠㅠㅠㅠ
어벤져스: 엔드게임,10,19.04.24,어벤져스 엔드게임 - 아임 아이언맨
어벤져스: 엔드게임,10,19.04.24,"Farewell, my heros..."
어벤져스: 엔드게임,2,19.04.24,허세와 감동으로 버무려진 시간낭비 무비 ㅎ 이런걸 보면서 쓸데없이 찔찔 짜는건 참..
어벤져스: 엔드게임,10,19.04.24,그동안 행복했어요.고마워요.
어벤져스: 엔드게임,10,19.04.24,여러분 인생영화입니다 마블이 또 사고쳤어요sf영화보고 울기는 또 처음;;보다가 눈물이 나는 자신에게 당황하게 됩니다감격스럽기도하고 슬프기도해서 순간순간 울컥하게됩니다
어벤져스: 엔드게임,10,19.04.24,히어로는 악당과 싸우고 이기는거라고 생각하는 사람들의 생각을 완전히 바뀌게 할 수 있는 영화.... 마블은 미친놈들이다... 진짜 스포 당하지말고 꼭 보세요...
어벤져스: 엔드게임,10,19.04.24,이때까지 나온 마블 영화의 엔딩 다웠습니다. 나머지는 직접 보세요
어벤져스: 엔드게임,8,19.04.24,너무 큰 기대하고 봐서 그런가... 약간 실망스러운 설정...하지만 러닝타임 내내 집중했습니다적절한 코믹 센스는 역시 마블따라갈 수가없구나 무릎을 탁침!ㅜㅠ 로다주 에반스 엄지척!
어벤져스: 엔드게임,10,19.04.24,I am IRONMAN
요로나의 저주,3,19.04.24,소름돋지만 재미는 없었다
어벤져스: 엔드게임,10,19.04.24,진짜 보고싶다라고 생각하게 만드 영화 반지의 제왕1편끝나고 2편기다리 던 그때 이후 처음이다
어벤져스: 엔드게임,10,19.04.24,너무잼 단지 그분이가시는건ㅠㅠ
어벤져스: 엔드게임,10,19.04.24,역대급 영화.. 말이 필요없다
어벤져스: 엔드게임,6,19.04.24,돌스톤 그리 쉽게 뺏어가는거면 인피니티워에서는 뭐한거냐 마무리 헬조선 수준
어벤져스: 엔드게임,10,19.04.24,"이게 끝이 아니길 바랍니다, 늙어서도 마블 영화 보고싶어요"
어벤져스: 엔드게임,10,19.04.24,너무 재밌었어요!꼭보세요!
어벤져스: 엔드게임,10,19.04.24,스포조심하세요 진심!! 쿠키영상은 하나도 없습니다
어벤져스: 엔드게임,10,19.04.24,너무 재밌당 두반봐라 진짜
어벤져스: 엔드게임,6,19.04.24,여친 때문에 억지로 봤지만 전 별로 였어요~ 생각보다 넘 지루... 솔직히 이게 뭐가 그렇게 재미있다는 거지..
어벤져스: 엔드게임,10,19.04.24,쿠키 없네요 ㅠ 아쉽게 다음 스파이더맨도 기대되네요
어벤져스: 엔드게임,10,19.04.24,아~~~ 머라 말해야. 할지 ..  슬프다. 웃기다. 슬프다. 웃기다 ㅜㅜ
미성년,10,19.04.24,김윤석!! 사랑해요 아자씨♥?
어벤져스: 엔드게임,10,19.04.24,재밌어요 시리즈의 마지막을 꼭 보시는걸 추천합니다
어벤져스: 엔드게임,10,19.04.24,흥분이가시질않네요대박!!
어벤져스: 엔드게임,6,19.04.24,뭐 너무길지만 뭐 그래요...
어벤져스: 엔드게임,10,19.04.24,지금까지 이런영화는 없었다..
어벤져스: 엔드게임,10,19.04.24,아임 아이언맨 ㅠㅠㅠ미쳤어
어벤져스: 엔드게임,10,19.04.24,이게 마블영화다. 뜬금없는 캡틴 마블 때문에 이미지 실추가 있었지만 인생의 몇년 동안 마블 영화가 있어 즐거웠다.
어벤져스: 엔드게임,9,19.04.24,"만남이 있으면 이별이 있고, 승리를 위해서는 희생이 있어야 된다는 것을 귀에 딱지 앉을 정도로 들어봤지만 아무리 듣고 봐도 적응이 안되는 건 이 영화에서도 마찬가지였다... 퇴장마저 멋진 그들을 잊지 않겠습니다. 어벤져스 어셈블..."
어벤져스: 엔드게임,10,19.04.24,Avengers assemble
어벤져스: 엔드게임,10,19.04.24,어벤져스다 그냥보면안다
어벤져스: 엔드게임,1,19.04.24,솔직히 엄복동이 더 재밌다
어벤져스: 엔드게임,10,19.04.24,꼭보세요 넘 잼나요 길어서 좀힘들긴하네요
어벤져스: 엔드게임,10,19.04.24,좋은 끝맺음이었어용 어벤져스잘마무리댄거같아용
어벤져스: 엔드게임,10,19.04.24,아이엠 아이언맨! ..
어벤져스: 엔드게임,10,19.04.24,세계가 허락한 유일한 마약이란 이런거야 뽕쟁이들아 마블 사랑해요
어벤져스: 엔드게임,10,19.04.24,"나를 위한 새드엔딩, 모두를 위한 해피엔딩, 마블 팬들을 위한 네버엔딩."
어벤져스: 엔드게임,10,19.04.24,단기 기억상실증걸리고 싶을정도로 다시 보고싶음
어벤져스: 엔드게임,10,19.04.24,I am Iron man ....
어벤져스: 엔드게임,10,19.04.24,누구한테는 해피엔딩     다만 저한테는 새드엔딩이었네요ㅠ
어벤져스: 엔드게임,10,19.04.24,앞 내용은 마블팬으로서 보면서 감동을 느끼고 마지막 30분은 눈물날뻔했고 끝나고나니 정말 끝인가하고 아쉽더라...어벤져스 어셈블 이때 ㄹㅇ 소름
어벤져스: 엔드게임,6,19.04.24,아이언맨 죽나요???
어벤져스: 엔드게임,10,19.04.24,영화는 완벽함.. 상영 이미 시작됐는데 들어오는거면 조심히 들어와라 이미 영화 시작했는데 어둡다고 지 자리찾는다고 핸드폰 불키고 들어오는건 뭐냐
어벤져스: 엔드게임,10,19.04.24,3000만큼 최고!!!
어벤져스: 엔드게임,10,19.04.24,재밌게 잘 봤습니다~시간가는 줄 모르고 봤네요^^
어벤져스: 엔드게임,10,19.04.24,말이필요하지아니 말이ㅡ필여업새
어벤져스: 엔드게임,8,19.04.24,근데 마지막에 스톤들 과거로 되돌리러 갈때 분명 캡틴은 망치 들고 갔는데 늙어서 왔을때는 흑형한테 방패만 주네. 밑장빼기냐?
어벤져스: 엔드게임,8,19.04.24,먼가 아쉽...스파이더맨 등장..울컥..
여인의 향기,10,19.04.24,삶의 한줄기 빛같은 영화
어벤져스: 엔드게임,10,19.04.24,"길게 잘봤네ㅋ 3,000만큼 사랑합니다ㅋ"
어벤져스: 엔드게임,10,19.04.24,팁)마블 영화 다시 정주행하고 보시길
어벤져스: 엔드게임,9,19.04.24,알바들 조차 양심에 질려 1점을 못 주는 상황... 너무 걸작이라 함부로 1점을 못 줌 ㅋㅋ
어벤져스: 엔드게임,10,19.04.24,"MCU, 토니 스타크로 시작해 아이언맨으로 끝나다"
어벤져스: 엔드게임,10,19.04.24,토르 걍 개그캐됐네 ㅎㅎ... 아이언맨이 다했네
어벤져스: 엔드게임,10,19.04.24,영화 영화관에서 두번 안보는데 한번도볼 예정
어벤져스: 엔드게임,9,19.04.24,개연성 있게 페이즈 1을 잘 끝낸 느낌전투신은 인피니티워보다는 좀 아쉬웠음
어벤져스: 엔드게임,10,19.04.24,미쳤음 어벤져스ㅠㅠ 사랑해 안녕ㅠㅠ
어벤져스: 엔드게임,10,19.04.24,3시간이 정말 어떻게 지나가는지도 모르게 너무재밌고 그냥 온갖 감정의 눈물이 너무재밌고 정말..걍최고에요 벅차오른다는게 이런거같아요!! 스포차단하고 빨리보러가세요!
어벤져스: 엔드게임,10,19.04.24,오늘 보기를 잘했습니다.
어벤져스: 엔드게임,10,19.04.24,볼 수 있어서 정말 영광이었습니다. 단언코 내 인생 최고의 영화
어벤져스: 엔드게임,10,19.04.24,재미있네요 마지막 이라 좀 아쉽네요
어벤져스: 엔드게임,10,19.04.24,지난 어벤져스는 이번 시리즈의 예고편 이었다!!!
어벤져스: 엔드게임,10,19.04.24,180분~~~순삭이욤~~~~ㅎㅎㅎ
어벤져스: 엔드게임,10,19.04.24,진짜 좋았어요ㅜㅠ 마지막에 쿠키영상은 없고 출연자 이름과 각자 사인 보고 나왔습니다 아직 안보신 분들 위하 스포는 자제하겠습니다 상영시간 기니까 그냥 먹을거랑 마실것 사지마세요!!!
어벤져스: 엔드게임,10,19.04.24,대박이라는 말밖에 안나오네요
어벤져스: 엔드게임,10,19.04.24,재미는 있지만 뭔가 마지막 페이지라고 하기에는 허무한 결말
어벤져스: 엔드게임,10,19.04.24,"고마워요, 정말. 더 무슨 말을 하겠어요.3000만큼 사랑해요"
어벤져스: 엔드게임,10,19.04.24,재밌게 잘봤어요또보러가고싶네요
어벤져스: 엔드게임,10,19.04.24,"긴 여정의 끝, 나는 누구인가의 고민에서 시작된 각 히어로들이 짊어진 사명의 완수가 완벽했다고 생각합니다 각 등장 인물들에 맞는 결말들이었습니다"
어벤져스: 엔드게임,10,19.04.24,캡틴이 묠니르를 어케드냐고 하는분들아 어벤져스2편 울트론편을 자세히 보고오시길
어벤져스: 엔드게임,7,19.04.24,비전을 못살리고 헐크 타노스와 마짱 뜨는거 없어 아쉽다
어벤져스: 엔드게임,10,19.04.24,어벤져스 어셈블! 재밌었습니다. 한번 더 봐야겠어요
어벤져스: 엔드게임,10,19.04.24,오늘 치즈버거 먹어야지..
어벤져스: 엔드게임,10,19.04.24,그냥 최고다~ 최고의 마무리
어벤져스: 엔드게임,10,19.04.24,3000점 정도 재밌음
어벤져스: 엔드게임,10,19.04.24,아싸리 리뷰절대보지 마세요.이 영화 정말최곱니다.
어벤져스: 엔드게임,10,19.04.24,3000만큼 사랑해 ㅠㅠ
어벤져스: 엔드게임,10,19.04.24,3000만큼 사랑해 ㅠㅠ
어벤져스: 엔드게임,10,19.04.24,반전에 반전에  반전인 영화
어벤져스: 엔드게임,10,19.04.24,아...보통 영화보고 안우는데 이 영화보면서 뭉클하고 눈물이 고였네요. 고맙습니다. 어벤져스!!
어벤져스: 엔드게임,6,19.04.24,앞 부분만 약간 지루했고 재밌었어요 엄청 기대하고 봐서인지 끝났을때 뭔가 허무한 느낌이네요 아 이제 끝인건가 .쿠키영상 없습니다
어벤져스: 엔드게임,10,19.04.24,이전 마블 영화 뺴먹은거 있는사람은 필히 그것부터 다 보고 영화관 갈것을 추천함. 빼먹은게 있을수록 재미는 떨어짐.
마녀,1,19.04.24,재미없어 구닥다리 캐릭터들의 현실감이 너무 없네요
어벤져스: 엔드게임,10,19.04.24,넘대박 ㅠㅠㅠㅠ 최고예요
스윙키즈,10,19.04.24,이데올로기 전쟁 속에 피어난 청춘들의 열정반짝반짝 빛나는 도경수의 눈빛과 연기꼭 여러번 보시길 추천드려요
어벤져스: 엔드게임,10,19.04.24,"작품으로 승화한 팬보이들의 밈, 혹은 기억. 고마워요. 그리고 잘가요."
어벤져스: 엔드게임,9,19.04.24,스케일 크고 완결판이라 할만 합니다
어벤져스: 엔드게임,10,19.04.24,2000만도 충분히 돌파가능하다고 생각한다 나도 오늘 한번 월요일 4DX로 또 볼거니까. 진짜 10년 마블의 끝맺음이 이렇게 깔끔할수가...
어벤져스: 엔드게임,10,19.04.24,고마워요 당신을 처음 만난 11년 전이 떠올라 쉽게 자리를 떠나지 못했습니다.
어벤져스: 엔드게임,10,19.04.24,인생작 존잼입니다 꼭 보세요
어벤져스: 엔드게임,10,19.04.24,재밌다는 말로는 표현이 부족한데 뭐라고 해야할 지 모를 정도로 미쳤다...
어벤져스: 엔드게임,10,19.04.24,내생에 최고의 영화.. 이젠 어벤져스 시리즈 더이상 안나오겠죠ㅠ
어벤져스: 엔드게임,10,19.04.24,9살부터 20살 현재까지 11년동안 이 영화들이 있어 정말 많이 웃어왔는데 오늘만큼은 울고 싶네요...정말 마블팬 모두에게 기념비적인 영화임에 틀림없습니다. 꼭 보시고 이미 보신 분들은 아직 안 보신 분들을 배려해서 스포일러 자제합시다.””
어벤져스: 엔드게임,6,19.04.24,결말 아쉽다 기대가 너무 컷나봐ㅜ
어벤져스: 엔드게임,8,19.04.24,완벽한 피날레에 티끌하나 묻었다. pc.
어벤져스: 엔드게임,9,19.04.24,스케일 크고 재밋음..이해안돼는 좀 쌩뚱맞은 장면 몇개빼고
어벤져스: 엔드게임,10,19.04.24,9.2  9.3 정도.드라마같은 슬 픈..전 많이 슬펐어요.3시간8분인데.빨리 지나갔어요
어벤져스: 엔드게임,10,19.04.24,영화 진짜  재밌습니다 다시 또 보고싶네요!!~~^^
어벤져스: 엔드게임,10,19.04.24,I'm Iron man
어벤져스: 엔드게임,10,19.04.24,달려가서보세요스포를접하기전에요
어벤져스: 엔드게임,10,19.04.24,"진짜 세시간동안 눈을 뗄 수가 없었다 ㅜㅜ 이 배우들은 이 영화찍고나서 어떤 기분이 들었을까... 미국인들 본인이 미국사람이라는 것에 대해 국뽕 차오르게 하는 영화일듯. 진심 최고,,,"
어벤져스: 엔드게임,10,19.04.24,아이언맨으로 시작하여 아이언맨으로 끝난다
어벤져스: 엔드게임,10,19.04.24,아이언맨으로 시작하여 아이언맨으로 끝난다
어벤져스: 엔드게임,10,19.04.24,어벤져스 끝판왕.... 정말 세시간이 어떻게 갔는지 모를정도예요
어벤져스: 엔드게임,10,19.04.24,한 번 보고는 잘 모르겠는데.. 3000만큼 좋은것 같기도..
어벤져스: 엔드게임,10,19.04.24,감사하다 증말로 3000만큼
어벤져스: 엔드게임,10,19.04.24,좋은 영화 감사합니다~~!!!
어벤져스: 엔드게임,8,19.04.24,영화가 지루하네요 마지막은 괜찮은듯
어벤져스: 엔드게임,10,19.04.24,I cried 5 times too.
어벤져스: 엔드게임,10,19.04.24,와....진짜 재밌어
어벤져스: 엔드게임,10,19.04.24,내가 애정하는 영웅을 이제 못본다 생각하니 슬프네요ㅠ
어벤져스: 엔드게임,10,19.04.24,진짜 재미있습니다 꼭 보세요
어벤져스: 엔드게임,10,19.04.24,죠빠진다..죠빠진다
어벤져스: 엔드게임,10,19.04.24,I love You 3000
어벤져스: 엔드게임,10,19.04.24,감동 그 자체입니다!!!!
어벤져스: 엔드게임,10,19.04.24,이제 뭘 기다리면 되는지나 던져 놓고 END하지...아직 살 날이 많이 남았는데...아놔...
어벤져스: 엔드게임,10,19.04.24,그냥 꿀잼 몸에 소름이 레알 마지막 영화 다움
어벤져스: 엔드게임,10,19.04.24,과연 이런 영화가 또 언제 나올까..
어벤져스: 엔드게임,6,19.04.24,"흠..나만 별로였나보다...그냥 어벤져스 팬들이 추억회상, 보고싶었던 사람들 보기에 좋은 영화임ㅇㅇ캡틴마블도 기대시킨만큼의 활약은 없었고,,,^^"
어벤져스: 엔드게임,10,19.04.24,스트레인지 나쁜놈 큰그림 그려서 자긴 살앗네
어벤져스: 엔드게임,8,19.04.24,방금봤다조금 허무 타노스다이아이어맨다이니타샤다이
어벤져스: 엔드게임,10,19.04.24,소름돋고 전율이 일어난다는게 이런건가 싶네요.
어벤져스: 엔드게임,10,19.04.24,3시간이짧았습니다.
어벤져스: 엔드게임,10,19.04.24,솔직히 전편이 더 액션이나 스토리는 잼있다 그치만 얀드게임은 이렇게 끝나는게 맞다 졸라 잼나다
어벤져스: 엔드게임,6,19.04.24,걍그러네볼만은함 아까워서글치 ㅋ
어벤져스: 엔드게임,10,19.04.24,마블은 디씨뿐만 아니라 마블 스스로도 이길수없는 작품을 만들어버렸다.. 큰일났다
어벤져스: 엔드게임,10,19.04.24,재미있어요ㄲㅋㅋ또보러가야지
어벤져스: 엔드게임,10,19.04.24,개쩐다진짜대박대박대박
어벤져스: 엔드게임,2,19.04.24,3시간짜리치곤 조질나게 지겹고 잼없더만..ㅜ 자다깨서 보고..자다깨서 보고..ㅋ
초능력자,10,19.04.24,재밌는데요 평점이왜이렇죠
어벤져스: 엔드게임,10,19.04.24,3000만큼 사랑해 마블 최고
어벤져스: 엔드게임,10,19.04.24,내 어린시절을 함께한 히어로들. 보면서 여러 의미로 뭉클하고 울컥했네요! 너무 재밌게 봤어요 꼭 보시길!!
어벤져스: 엔드게임,10,19.04.24,마블영화 보셨다면 보세요~
어벤져스: 엔드게임,8,19.04.24,"초반의 신파극, 일부 캐릭터 설정 급변경, 캐릭터 액션의 빈부 격차, 사나다 히로유키.. 이러한 감점 요인 때문에 인워가 더 낫다고 봄"
어벤져스: 엔드게임,10,19.04.24,나도 3000만큼 사랑함(아련
어벤져스: 엔드게임,10,19.04.24,무슨말이 더필요합니까.. 우리의 토니스타크. 우리의 캡틴이 되어줘서 고맙습니다. 그리고 돌아와서 반갑다!! 가오갤3가즈아아아아~!!!!
어벤져스: 엔드게임,10,19.04.24,재미와 감동이 있는 영화
어벤져스: 엔드게임,10,19.04.24,히어로즈 영화 끝판왕~ 최고
어벤져스: 엔드게임,10,19.04.24,개 쩝니다 진짜로.. 꼭 보세요
어벤져스: 엔드게임,10,19.04.24,쫄깃하네요  캡틴짱!!!
어벤져스: 엔드게임,10,19.04.24,스포충들아 적당히해라 바퀴벌레 보다도 못한것들 인생을 쓰ㅣ레기 처럼 산다 더러븐 시키들
캡틴 마블,10,19.04.24,와 재밌다 일하는 시간에 몰래보니까 더 꿀잼
어벤져스: 엔드게임,10,19.04.24,소름이 끼칠 정도로 놀라운 장면도 있고 재미있었네요 이제 못본다니 아쉽네요ㅠㅠ
어벤져스: 엔드게임,10,19.04.24,촤고의ㅜ양화! 완전 재밌엇다!
어벤져스: 엔드게임,10,19.04.24,마블캡틴 비중 작네요. 하향패치됐나 타노스한방에 날아가네ㅋㅋ 액션신이 후반부에 조금이지만 3시간 재밌게 잘봄. 아이언맨.캡틴아메리카.나타샤ㅜㅜ
어벤져스: 엔드게임,10,19.04.24,I am iron man
어벤져스: 엔드게임,10,19.04.24,완성도 최고다. 재예매하러 가야겠다.
어벤져스: 엔드게임,4,19.04.24,기대했던것보단 별로...
어벤져스: 엔드게임,10,19.04.24,내 인생에  이만큼 기다려지게 될 영화가 또 있을까 싶다....
어벤져스: 엔드게임,6,19.04.24,인피니티워가 조금 더 유쾌하고 즐거운 편이었던것같음. 1년을 기다렸는데 다소 허탈함
어벤져스: 엔드게임,10,19.04.24,아 정말 재밌다. 영화의 모든 요소를 다 갖췄다. 근데 캡틴 마블 왕따인것 같다
어벤져스: 엔드게임,10,19.04.24,어벤져스 보면서 눙물 날 줄은 몰랐는데 ㅠㅠ
어벤져스: 엔드게임,10,19.04.24,그저 최고라는 말밖엔..
어벤져스: 엔드게임,10,19.04.24,진짜 빨리보세요 님들 진짜 너무 재밌음 러닝타임 3시간 나 3시간보고 갔는데 순삭이었다 ㄹㅇ 빨리바
어벤져스: 엔드게임,10,19.04.24,역시 마블 재미와 소름 감동그리고 마지막에 ..ㅜㅜ
어벤져스: 엔드게임,10,19.04.24,어벤져스 앤드게임 꼭 보세요~~~
어벤져스: 엔드게임,8,19.04.24,어벤져스 드라마의 마지막회
